{
  "schema_version": "session_meta.v0",
  "case_id": "D-B03",
  "session_id": "D-B03-S03",
  "plugin_type": "divorce",
  "title": "Emotional betrayal context with orderly-process intent and moderate conflict",
  "scenario_summary": null,
  "source": "lm_runtime",
  "created_at": "2026-03-29T23:01:02Z"
}
