{
  "schema_version": "session_meta.v0",
  "case_id": "D-B08",
  "session_id": "D-B08-S02",
  "plugin_type": "divorce",
  "title": "Repeated interruption and procedural domination with co-handling escalation",
  "scenario_summary": null,
  "source": "lm_runtime",
  "created_at": "2026-03-29T00:00:00Z"
}
