{
  "schema_version": "session_meta.v0",
  "case_id": "D-B-RT03",
  "session_id": "D-B-RT03-S04",
  "plugin_type": "divorce",
  "title": "Surface cooperation masking coercion \u2014 compliant party with reactive-only interests and one discordant turn",
  "scenario_summary": null,
  "source": "lm_runtime",
  "created_at": "2026-03-29T22:24:54Z"
}
