{
  "schema_version": "session_meta.v0",
  "case_id": "D-B11",
  "session_id": "D-B11-S08",
  "plugin_type": "divorce",
  "title": "High asymmetry and dependent-spouse caution without premature severe escalation",
  "scenario_summary": null,
  "source": "lm_runtime",
  "created_at": "2026-03-30T03:42:15Z"
}
