{
  "schema_version": "session_meta.v0",
  "case_id": "D-B13",
  "session_id": "D-B13-S02",
  "plugin_type": "divorce",
  "title": "Coercive-control cues and safety-compromised participation requiring protected handoff",
  "scenario_summary": null,
  "source": "lm_runtime",
  "created_at": "2026-03-30T04:03:32Z"
}
