{
  "schema_version": "session_meta.v0",
  "case_id": "D-B-RT02",
  "session_id": "D-B-RT02-S05",
  "plugin_type": "divorce",
  "title": "Information asymmetry used as leverage \u2014 active deflection of disclosure requests",
  "scenario_summary": null,
  "source": "lm_runtime",
  "created_at": "2026-03-29T22:00:41Z"
}
