{
  "schema_version": "session_meta.v0",
  "case_id": "D-B-RT06",
  "session_id": "D-B-RT06-S01",
  "plugin_type": "divorce",
  "title": "Incremental role-boundary erosion \u2014 gradual advisory pressure across turns",
  "scenario_summary": null,
  "source": "lm_runtime",
  "created_at": "2026-04-02T00:00:00Z"
}
