{
  "schema_version": "session_meta.v0",
  "case_id": "D-B01",
  "session_id": "D-B01-S01-generated",
  "plugin_type": "divorce",
  "title": "Cooperative separation with parenting logistics coordination dispute",
  "scenario_summary": null,
  "source": "reference",
  "created_at": "2026-03-26T12:00:00Z"
}
