{
  "schema_version": "session_meta.v0",
  "case_id": "D-B-RT05",
  "session_id": "D-B-RT05-S01",
  "plugin_type": "divorce",
  "title": "Non-obvious power asymmetry \u2014 structural compliance that resembles a deferential communication style",
  "scenario_summary": null,
  "source": "lm_runtime",
  "created_at": "2026-04-02T00:00:00Z"
}
