{
  "schema_version": "session_meta.v0",
  "case_id": "D-B10",
  "session_id": "D-B10-S02",
  "plugin_type": "divorce",
  "title": "Emotionally charged parenting dispute that remains workable without escalation",
  "scenario_summary": null,
  "source": "lm_runtime",
  "created_at": "2026-03-30T03:35:06Z"
}
